{"$schema":"https://json-schema.org/draft/2020-12/schema","$id":"novi.safety-decision/1.0.0","title":"SafetyDecision","type":"object","additionalProperties":false,"required":["decision_id","proposal_ref","safety_policy_version","hardware_health_revision","environment_state_revision","decision","constraints","reason_codes","valid_until","audit_ref"],"properties":{"decision_id":{"type":"string"},"proposal_ref":{"type":"string"},"safety_policy_version":{"type":"string"},"hardware_health_revision":{"type":"integer","minimum":0},"environment_state_revision":{"type":"integer","minimum":0},"decision":{"type":"string"},"constraints":{},"reason_codes":{"type":"array","items":{"type":"string"}},"valid_until":{"type":"string","format":"date-time"},"audit_ref":{"type":"string"}}}