{
  "audit_ref": "fixture-value",
  "constraints": {},
  "decision": "fixture-value",
  "decision_id": "fixture-value",
  "environment_state_revision": 1,
  "hardware_health_revision": 1,
  "proposal_ref": "fixture-value",
  "reason_codes": [
    "fixture-value"
  ],
  "safety_policy_version": "fixture-value",
  "valid_until": "2026-01-01T00:00:00Z"
}
